{
  "action_prompt": "Pensa em UM hábito que você vinha adiando. Agora corta ele até caber em 2 minutos: 'ler 1 página', '5 flexões', 'escrever 1 frase', '5 min de violão'. Faz a versão pequena AGORA, antes de continuar a aula.",
  "sensory_anchor": "Como o cérebro reagiu na hora de começar — resistência, alívio, vontade de fazer mais? Em quantos segundos a versão minúscula foi feita?",
  "expected_time_seconds": 80,
  "reveal": "Geralmente acontece uma das duas: ou o cérebro relutou e você fez no automático (o que já vale como voto), ou começou a versão de 2 min e teve vontade de continuar 10. As duas servem. O voto registrado é o mesmo: 'sou alguém que faz isso'. Repita amanhã. E depois. O resto é tempo."
}
