{
  "action_prompt": "Agora. Escolha UMA tarefa que normalmente você empurra com a barriga — lição que você adia, capítulo de livro, organizar uma gaveta. Põe celular em outra sala. Liga timer de 25 minutos. Faz só isso. Sem checar nada.",
  "sensory_anchor": "Em que minuto bateu a primeira vontade forte de levantar? E em que minuto o cérebro 'travou na tarefa' e o tempo passou sem você notar? Se o segundo aconteceu — você acabou de tocar foco profundo.",
  "expected_time_seconds": 90,
  "reveal": "Os primeiros 8-15 minutos são os mais duros — o cérebro reclama, tenta sabotar, sugere checar coisas. Depois disso, em geral entre o minuto 15 e 20, algo muda: você simplesmente está NA tarefa. Esse 'estar dentro' é o foco profundo. Quem nunca passa do minuto 10 nunca conhece esse modo."
}
