{
  "action_prompt": "Pega uma caneta esferográfica e pinta a polpa do polegar passando bem — não muito, só pra cobrir o desenho. Pressiona o polegar numa folha branca. Olha a marca com o celular no zoom máximo. Compara com o polegar da outra mão.",
  "sensory_anchor": "Os dois polegares têm o MESMO desenho? Procura: arcos curvos, laços fechados, pontos espirais. Os dois polegares de uma mesma pessoa são diferentes entre si.",
  "expected_time_seconds": 90,
  "reveal": "A digital se forma no útero entre as semanas 13 e 19, quando pele e tecido por baixo crescem em ritmos diferentes e amassam o desenho. Como o amasso depende de pressão do líquido e posição do bebê, gêmeos idênticos têm digitais diferentes. O DNA não desenha — o caos do crescimento desenha."
}
