{
  "action_prompt": "Liga modo avião no celular AGORA. Põe um timer de 30 minutos em um relógio que não seja o celular. Escolhe UMA tarefa de verdade — lição, ler um capítulo, organizar a mochila. Faz só ela.",
  "sensory_anchor": "Quantas vezes a mão foi em direção ao celular no piloto automático? Em que minutos? E quando você terminou, o que sobrou na cabeça que normalmente não sobraria?",
  "expected_time_seconds": 75,
  "reveal": "A maioria reporta a mesma coisa: nos primeiros 5 minutos, vontade forte de pegar o celular 'pra checar'. Depois, uma calma que parece quase estranha. Esse silêncio era seu — só estava encoberto. Você acabou de descobrir o que o cérebro faz quando NINGUÉM o interrompe."
}
